iMessage Contact Key Verification · Security Keys · Advanced Data Protection for iCloud · Press Contacts · Latest News · Apple Footer.5 months ago, https://www.apple.com/newsroom/2022/12/apple-advances-user-security-with-powerful-new-data-protections/
Apple is expected to launch four new models this year – iPhone 15 iPhone 15 Plus iPhone 15 Pro and iPhone 15 Pro Max. With the arrival of...3 weeks ago, https://tech.hindustantimes.com/mobile/news/after-iphone-15-launch-will-apple-discontinue-your-iphone-12-iphone-14-pro-and-more-71681614297631.html
Apple's more than 100000 employees are dedicated to making the best products on earth and to leaving the world better than we found it. Press...1 month ago, https://www.apple.com/newsroom/2023/03/apples-worldwide-developers-conference-returns-june-5/
Filipe Espósito is a Brazilian tech Journalist who started covering Apple news on iHelp BR with some exclusive scoops — including the reveal of...3 weeks ago, https://9to5mac.com/2023/04/13/apple-tv-growth-slows-in-us/
AirPods · App Store · Apple Arcade · Apple TV+ · Company News · Education · Environment · Events · Health · iPad · iPhone · Mac · Music...3 months ago, https://www.apple.com/newsroom/2023/01/introducing-apple-business-connect/
Apple's more than 100000 employees are dedicated to making the best products on earth and to leaving the world better than we found it. Press...1 month ago, https://www.apple.com/newsroom/2023/03/apples-worldwide-developers-conference-returns-june-5/
Filipe Espósito is a Brazilian tech Journalist who started covering Apple news on iHelp BR with some exclusive scoops — including the reveal of...3 weeks ago, https://9to5mac.com/2023/04/13/apple-tv-growth-slows-in-us/
AirPods · App Store · Apple Arcade · Apple TV+ · Company News · Education · Environment · Events · Health · iPad · iPhone · Mac · Music...3 months ago, https://www.apple.com/newsroom/2023/01/introducing-apple-business-connect/
After the Whistle will premiere on November 17 2022 and will be available for free in Apple News and Apple Podcasts. As the World Cup kicks...5 months ago, https://www.apple.com/newsroom/2022/11/apple-news-presents-after-the-whistle-with-brendan-hunt-and-rebecca-lowe-podcast/
My Sports also makes it easy to get personalized real-time sports coverage from Apple News. Fans can stay up to speed with the best stories...3 months ago, https://www.apple.com/newsroom/2023/02/mls-season-pass-is-now-available-worldwide-on-the-apple-tv-app/
The feature is not available for Apple Music Voice Plan subscribers. Press Contacts. Jessica Bass. Apple. jessica_bass@apple.com. Apple Media...5 months ago, https://www.apple.com/newsroom/2022/12/apple-introduces-apple-music-sing/
Apple has positioned the Sports tab in ‌Apple News‌ right in the middle of the bottom navigation bar putting it between Today and News+ on...1 month ago, https://www.macrumors.com/2023/03/28/apple-news-app-sports-tab-ios-16-5/
AirPods · App Store · Apple Arcade · Apple TV+ · Company News · Education · Environment · Events · Health · iPad · iPhone · Mac · Music...2 months ago, https://www.apple.com/newsroom/2023/03/hello-yellow-apple-introduces-new-iphone-14-and-iphone-14-plus/
Apple's more than 100000 employees are dedicated to making the best products on earth and to leaving the world better than we found it. Press...3 months ago, https://www.apple.com/newsroom/2023/01/apple-builds-on-privacy-commitment-by-unveiling-new-efforts-on-data-privacy-day/
Apple launches 20 fun new games for its award-winning Apple Arcade service. May 4 2023. Apple Newsroom. The latest news and updates direct...1 month ago, https://www.apple.com/newsroom/2023/04/apple-and-global-suppliers-expand-renewable-energy-to-13-point-7-gigawatts/
Restrictions and limitations may apply. Press Contacts. Neema Mungai. Apple. nmungai@apple.com. Brian Bumbery.1 month ago, https://www.apple.com/newsroom/2023/03/apple-introduces-shop-with-a-specialist-over-video/
On iOS Apple News provides access to newspapers and magazines for $9.99 per month. But despite boasting the Apple brand and a considerable...3 months ago, https://www.androidpolice.com/best-apple-news-alternatives/
The Apple News app is a great way to consume news from multiple publications in one area. The application allows you to personalize your reading...6 months ago, https://appleinsider.com/inside/apple-news/tips/how-to-share-customize-apple-news-in-ios-16
It requires all Apple devices that access the home to be using the latest software. Smart home accessories are sold separately. Press Contacts.3 months ago, https://www.apple.com/newsroom/2023/01/apple-introduces-the-new-homepod-with-breakthrough-sound-and-intelligence/
A Canvas Built for Creativity with Easy-to-Use Tools · A Collaboration Space · Press Contacts · Latest News · Apple Footer.4 months ago, https://www.apple.com/newsroom/2022/12/apple-launches-freeform-a-powerful-new-app-designed-for-creative-collaboration/
Latest News. UPDATE. Apple launches 20 fun new games for its award-winning Apple Arcade service.1 month ago, https://www.apple.com/newsroom/2023/03/apple-gangnam-now-open-in-south-korea/
Unrivaled Power-Efficient Performance with M2 Pro and M2 Max · Enhanced Connectivity · macOS Ventura · MacBook Pro and the Environment · Press...3 months ago, https://www.apple.com/newsroom/2023/01/apple-unveils-macbook-pro-featuring-m2-pro-and-m2-max/
This press release contains forward-looking statements within the meaning of the Private Securities Litigation Reform Act of 1995.6 months ago, https://www.apple.com/newsroom/2022/11/update-on-supply-of-iphone-14-pro-and-iphone-14-pro-max/
Stay Connected; MLS on Apple News · Newsletters · Podcasts · iOS App · Android App. Resources; MLS Communications · MLS Español...17 hours ago, https://www.mlssoccer.com/news/fc-dallas-vs-st-louis-city-sc-match-enters-weather-delay
Local news offerings in Apple News provide readers with access to top publications including Axios Charlotte the Charlotte Observer...18 months ago, https://www.apple.com/newsroom/2021/10/apple-news-expands-local-news-offerings/
Apple News introduces a new My Sports section where users can easily ... and college leagues; and watch highlights right in the News app.6 months ago, https://www.apple.com/newsroom/2022/10/ipados-16-is-available-today/
March 2 2023 12:57 p.m.. After Alex Kotch got into the habit of scrolling Apple News every morning in 2020 he started to find the offering...2 months ago, https://www.niemanlab.org/2023/03/optout-aims-to-be-a-daily-news-app-100-free-from-corporate-media-narratives/
Apple's more than 100000 employees are dedicated to making the best products on earth and to leaving the world better than we found it. Press...5 months ago, https://www.apple.com/newsroom/2022/12/apple-announces-biggest-upgrade-to-app-store-pricing-adding-700-new-price-points/
Apple's more than 100000 employees are dedicated to making the best products on earth and to leaving the world better than we found it. Press...1 month ago, https://www.apple.com/newsroom/2023/03/apple-music-classical-is-here/
iOS 16's Visual Look Up on a French bulldog on iPhone 14 Pro. Users can now press and hold on the subject of an image to lift it from the...7 months ago, https://www.apple.com/newsroom/2022/09/ios-16-is-available-today/
Fans can also sync their favorite teams across Apple News and the Apple TV app to follow updates get tune-in reminders and more.3 months ago, https://www.apple.com/newsroom/2023/01/apple-celebrates-a-groundbreaking-year-in-entertainment/
So you're back to work after the long holiday break? As we dive into 2023 these slices of Apple-related news should prep you for the year...4 months ago, https://www.computerworld.com/article/3684370/a-back-to-business-apple-news-briefing.html
This includes press releases and other information about financial performance reports filed or furnished with the SEC information on...6 months ago, https://www.apple.com/newsroom/2022/10/apple-reports-fourth-quarter-results/
Latest News. PRESS RELEASE. Apple MixC Shenzhen opens Friday April 28 in China. April 26...5 months ago, https://www.apple.com/newsroom/2022/11/emergency-sos-via-satellite-available-today-on-iphone-14-lineup/
Testing was done under the condition of streaming 4K movies played on Apple TV 4K with the Siri Remote from the Apple TV app. Press Contacts.6 months ago, https://www.apple.com/newsroom/2022/10/apple-introduces-the-powerful-next-generation-apple-tv-4k/
Apple invites Ted Lasso fans to “believe” with new Today at Apple session · Press Contacts · Latest News · Apple Footer.1 month ago, https://www.apple.com/newsroom/2023/03/apple-invites-ted-lasso-fans-to-believe-with-new-today-at-apple-session/
Kickboxing and New Trainers · Introducing Sleep Meditation · Artist Spotlight with Beyoncé · Time to Walk · Collections · Press Contacts · Latest News.4 months ago, https://www.apple.com/newsroom/2023/01/apple-fitness-plus-unveils-new-offerings-for-the-new-year/
Apple's more than 100000 employees are dedicated to making the best products on earth and to leaving the world better than we found it. Press...5 months ago, https://www.apple.com/newsroom/2022/11/app-store-awards-celebrate-the-best-apps-and-games-of-2022/
5G wireless plan and coverage required. Speeds will vary. Check with carriers for details. Press Contacts. Apple Media Helpline. media.6 months ago, https://www.apple.com/newsroom/2022/10/apple-introduces-next-generation-ipad-pro-supercharged-by-the-m2-chip/
Variable APRs range from 13.99 percent to 24.99 percent based on creditworthiness. Rates as of October 1 2022. Press Contacts. Apple Media...6 months ago, https://www.apple.com/newsroom/2022/10/apple-card-will-let-users-grow-daily-cash-rewards-while-saving-for-the-future/
Eligibility is based on a threshold of plays and time spent listening. Press Contacts. Kevin Smith. Apple. smith_k@apple.com. Giovanni Bossio.5 months ago, https://www.apple.com/newsroom/2022/11/apple-music-launches-new-replay-experience-reveals-2022s-top-charts/
Apple News has had its ups and downs over the years both attracting some large publishers to the platform and losing others.1 month ago, https://9to5mac.com/2023/03/12/the-guardian-embraces-apple-news-after-initial-doubt-significant-opportunities-to-reach-a-wider-audience/
Apple News introduces a new My Sports section to easily follow favorite ... and college leagues; and watch highlights right in the News app.11 months ago, https://www.apple.com/newsroom/2022/06/apple-unveils-new-ways-to-share-and-communicate-in-ios-16/
Apple's more than 100000 employees are dedicated to making the best products on earth and to leaving the world better than we found it. Press...1 month ago, https://www.apple.com/newsroom/2023/03/Apple-TV-plus-wins-Academy-Award-for-The-Boy-the-Mole-the-Fox-and-the-Horse/
With iOS 16 Apple News introduced a new My Sports section for users to easily follow their favorite clubs teams and leagues; receive stories...5 months ago, https://www.apple.com/newsroom/2022/11/apple-and-major-league-soccer-announce-mls-season-pass-launches-february-1-2023/
With iOS 16 Apple News introduced a new My Sports section for users to easily follow their favorite clubs teams and leagues; receive stories...5 months ago, https://www.apple.com/newsroom/2022/11/apple-and-major-league-soccer-announce-mls-season-pass-launches-february-1-2023/
Apple News+ audio stories a new daily audio briefing and curated local news collections are all available now in Apple News.33 months ago, https://www.apple.com/newsroom/2020/07/apple-news-launches-new-audio-features-expands-local-news-offerings-for-readers/
AirPods · App Store · Apple Arcade · Apple TV+ · Company News · Education · Environment · Events · Health · iPad · iPhone · Mac · Music...5 months ago, https://www.apple.com/newsroom/2022/12/apple-launches-self-service-repair-in-europe/
Apple News uses its own algorithm powered by the user's likes or dislikes to show the most appropriate headlines. Here's how you can use...9 months ago, https://appleinsider.com/articles/22/07/13/how-to-customize-your-own-apple-news-personal-feed
Emergency SOS via satellite on iPhone 14 and iPhone 14 Pro lineups made possible by $450 million Apple investment in US infrastructure · Press...5 months ago, https://www.apple.com/newsroom/2022/11/emergency-sos-via-satellite-made-possible-by-450m-apple-investment/
AirPods · App Store · Apple Arcade · Apple TV+ · Company News · Education · Environment · Events · Health · iPad · iPhone · Mac · Music...6 months ago, https://www.apple.com/newsroom/2022/10/apple-fitness-plus-available-to-iphone-users-in-21-countries-starting-october-24/
Press Gazette also shared a chart of how the top ten Apple News+ ... isn't necessarily an indicator of the success (or not) of Apple News.5 months ago, https://appleinsider.com/articles/22/12/05/biggest-apple-news-magazines-may-be-having-a-tough-time
Additional iPhone Payments terms are at apple.com/legal/sales-support/iphoneinstallments_us. Press Contacts. Apple Media Helpline. media.help@...8 months ago, https://www.apple.com/newsroom/2022/09/apple-introduces-iphone-14-and-iphone-14-plus/
A Look Back at Some of Bad Bunny's Biggest Moments on Apple Music · Press Contacts · Latest News · Apple Footer.5 months ago, https://www.apple.com/newsroom/2022/11/bad-bunny-is-apple-musics-artist-of-the-year-for-2022/
Latest News. UPDATE. Apple Google partner on an industry specification to address unwanted tracking. May 2...6 months ago, https://www.apple.com/newsroom/2022/10/apple-music-and-mercedes-benz-bring-immersive-spatial-audio-to-drivers-worldwide/
Two women are alleging that Apple's AirTag devices encourage stalking and put their safety at risk. Apple marked a grim milestone this week...4 months ago, https://abcnews.go.com/Business/apples-plunged-1-trillion-2022-economy/story?id=95930467
The ECG app is cleared for use in adult patients. Pediatric use is limited to investigational use only. Press Contacts. Zaina Khachadourian.2 months ago, https://www.apple.com/newsroom/2023/02/with-apple-watch-researchers-explore-new-frontiers-in-heart-health/
Apple's News app has been around for years on the iPhone iPad ... Still Apple News provides me with top headlines of events around the...4 months ago, https://www.theverge.com/23512499/twitter-news-alternatives-apple-google-rss-techmeme
AirPods · App Store · Apple Arcade · Apple TV+ · Company News · Education · Environment · Events · Health · iPad · iPhone · Mac · Music...1 month ago, https://www.apple.com/newsroom/2023/03/meet-four-women-using-apps-and-games-to-drive-culture-and-create-change/
All Apple News users in the US Canada UK and Australia can continue to enjoy the free news experience within the app on iPhone iPad and Mac...49 months ago, https://www.apple.com/newsroom/2019/03/apple-launches-apple-news-plus-an-immersive-magazine-and-news-reading-experience/
Apple empowers small businesses to grow and serve their customers. April 26 2023 · Apple Newsroom. The latest news and updates direct from...9 months ago, https://www.apple.com/newsroom/2022/07/how-apple-is-empowering-people-with-their-health-information/
Apple is reportedly developing software to comply with new European Union ... could only take effect in Europe according to Bloomberg News.4 months ago, https://www.cnbc.com/2022/12/14/why-europes-efforts-to-open-up-the-iphone-wont-hurt-apple-too-much.html
In Apple News fans can easily follow the league and their favorite teams ... and watch personalized MLB highlights right in the News app.1 month ago, https://www.apple.com/newsroom/2023/03/friday-night-baseball-resumes-on-apple-tv-plus-on-april-7/
AirPods · App Store · Apple Arcade · Apple TV+ · Company News · Education · Environment · Events · Health · iPad · iPhone · Mac · Music...8 months ago, https://www.apple.com/newsroom/2022/09/apple-reveals-apple-watch-series-8-and-the-new-apple-watch-se/
This includes press releases and other information about financial performance reports filed or furnished with the SEC information on...3 months ago, https://www.apple.com/newsroom/2023/02/apple-reports-first-quarter-results/
Coding with Today at Apple · Resources for Learners and Educators · Careers for the Next Generation · Press Contacts · Latest News · Apple Footer.5 months ago, https://www.apple.com/newsroom/2022/11/apple-expands-its-coding-education-resources-with-a-new-today-at-apple-session/
For additional information see support.apple.com/en-us/HT205000. Press Contacts. Nikki Rothberg. Apple. nrothberg@apple.com. (408) 974-4427.5 months ago, https://www.apple.com/newsroom/2022/11/reach-new-depths-with-the-oceanic-plus-app-and-apple-watch-ultra/
Super Bowl LVII Halftime Show Press Conference. On February 9 2023 at 10 a.m. MST Apple Music Radio's Nadeska Alexis will interview Rihanna...3 months ago, https://www.apple.com/newsroom/2023/01/apple-music-launches-rihannas-road-to-halftime-ahead-of-super-bowl-lvii/
Press the stem to change the music answer phone calls and more or say “Hey Siri” to make requests hands-free. The improved built-in...8 months ago, https://www.apple.com/newsroom/2022/09/apple-announces-the-next-generation-of-airpods-pro/
Apple expands industry-leading commitment to protect users from highly targeted mercenary spyware · Press Contacts · Latest News · Apple Footer.10 months ago, https://www.apple.com/newsroom/2022/07/apple-expands-commitment-to-protect-users-from-mercenary-spyware/
Follow MLS Clubs on the Apple TV App and Apple News. Fans can ensure they catch all of the action in 2023 by following their favorite MLS clubs...4 months ago, https://www.apple.com/newsroom/2022/12/major-league-soccer-announces-2023-season-schedule/
Apple is introducing integration between the Weather and News apps as noticed in the latest iOS 16.2 beta. People in cities such as San...6 months ago, https://appleinsider.com/articles/22/11/03/ios-162-surfaces-relevant-apple-news-stories-in-the-weather-app
Data is a real-time snapshot *Data is delayed at least 15 minutes. Global Business and Financial News Stock Quotes and Market Data and...2 months ago, https://www.cnbc.com/2023/03/03/apple-crackdown-on-chatgpt-apps-unlikely-new-rules-possible-later.html
Sergiu Gatlan has covered cybersecurity technology and other news beats for more than a decade. Email or Twitter DMs for tips. Previous...2 months ago, https://www.bleepingcomputer.com/news/security/apple-fixes-new-webkit-zero-day-exploited-to-hack-iphones-macs/
This includes press releases and other information about financial performance reports filed or furnished with the SEC information on...9 months ago, https://www.apple.com/newsroom/2022/07/apple-reports-third-quarter-results/
Here are some of the news that caught our attention. Apple Pays $14.8 Million Over iCloud Settlement. Close-Up Shot of a Handshake.4 months ago, https://www.makeuseof.com/apple-biggest-news-moments-2022/
Latest News. UPDATE. Apple Music Live returns for a brand-new season with Ed Sheeran. May...2 months ago, https://www.apple.com/newsroom/2023/02/mcintosh-seed-preserves-land-and-legacy-with-black-landowners-in-the-us-south/
Apple is also more closely watching travel budgets and leaving some unfilled positions open according to the report. related investing news.1 month ago, https://www.cnbc.com/2023/03/14/apple-delaying-some-employee-bonuses-as-the-company-cuts-costs-report.html
Follow MLS Clubs on the Apple TV App and Apple News. With iOS 16 Apple introduced a new My Sports section on the Apple TV app across iPhone...3 months ago, https://www.apple.com/newsroom/2023/01/apple-and-major-league-soccer-unveil-broadcasters-for-mls-season-pass/
4New Button Changes in Apple News · The Suggest More and Suggest Less buttons have been moved to the top bar and combined into one Suggest More...4 days ago, https://ios.gadgethacks.com/how-to/ios-16-5-has-15-new-updates-for-your-iphone-including-big-changes-apple-tv-apple-news-and-siri-0385349/
“As a result two obscene and racist push notifications were sent to our followers in Apple News about a minute apart. The messages are vile...7 months ago, https://www.cnn.com/2022/09/27/media/fast-company-apple-news/index.html
Latest News. UPDATE. Apple Music Live returns for a brand-new season with Ed Sheeran. May...7 months ago, https://www.apple.com/newsroom/2022/09/iphone-14-lineup-apple-watch-series-8-and-new-apple-watch-se-arrive-worldwide/
Apple's more than 100000 employees are dedicated to making the best products on earth and to leaving the world better than we found it. Press...8 months ago, https://www.apple.com/newsroom/2022/09/apple-fitness-plus-available-to-all-iphone-users-in-21-countries-later-this-fall/
Sweat and water resistance are not permanent conditions. Lanyards are sold separately. Press Contacts. Apple Media Helpline. media.help@apple.7 months ago, https://www.apple.com/newsroom/2022/09/apple-watch-ultra-and-next-generation-airpods-pro-available-in-stores-friday/
Advertisement in Apple News. Credit: Mark Gurman. In the News and Stocks apps the display ads are no different than what you might get on an...8 months ago, https://www.bloomberg.com/news/newsletters/2022-08-14/apple-aapl-set-to-expand-advertising-bringing-ads-to-maps-tv-and-books-apps-l6tdqqmg
Celebrating 100 million songs · Press Contacts · Latest News · Apple Footer.7 months ago, https://www.apple.com/newsroom/2022/10/celebrating-100-million-songs/
An FBI agent who investigated an earlier wave of mysterious cattle deaths on tribal lands told The Associated Press that there was no indication...2 weeks ago, https://www.nbcnews.com/news/us-news/six-cattle-died-mysteriously-texas-tongues-removed-authorities-say-rcna80957
When Apple releases this year's iPhones the iPhone 15 series among the design changes expected is a crucial one: the shift from charging...1 month ago, https://www.forbes.com/sites/davidphelan/2023/03/25/apple-iphone-15-leak-exposes-good-and-bad-news/
Taking a look back at another week of news and headlines from Cupertino this week's Apple Loop includes a surprise iPhone updateMacBook...2 months ago, https://www.forbes.com/sites/ewanspence/2023/02/10/apple-news-iphone-15-ultra-leak-macbook-pro-icloud-ipad-app-store-superbowl/
related investing news. Apple results show iPhone's 'consumer staple nature' in a tough environment Wall Street. CNBC Pro.3 months ago, https://www.cnbc.com/2023/01/30/apple-expected-to-post-first-revenue-decline-since-2019-on-thursday-.html
Latest News. UPDATE. Apple launches 20 fun new games for its award-winning Apple Arcade service.6 months ago, https://www.apple.com/newsroom/2022/10/apple-calls-on-global-supply-chain-to-decarbonize-by-2030/
Apple's Messages app now lets users do a lot more than just text and share media. With the latest iOS updates even more functions are available...4 months ago, https://www.foxnews.com/tech/apple-messages-app-features-to-remember
Accuracy of Live Captions may vary and should not be relied upon in high-risk situations. Press Contacts. Apple Media Helpline. media.help@apple...6 months ago, https://www.apple.com/newsroom/2022/10/macos-ventura-is-now-available/
AirPods · App Store · Apple Arcade · Apple TV+ · Company News · Education · Environment · Events · Health · iPad · iPhone · Mac · Music...7 months ago, https://www.apple.com/newsroom/2022/09/how-to-order-the-all-new-iphone-apple-watch-and-airpods-pro-lineups/
AirDrop which allows users to share content between Apple ... Still while the unrest has been well-documented in the international press...5 months ago, https://www.cnbc.com/2022/11/30/apple-limited-a-crucial-airdrop-function-in-china-just-weeks-before-protests.html
Latest News. UPDATE. Apple Music Live returns for a brand-new season with Ed Sheeran. May...2 months ago, https://www.apple.com/newsroom/2023/03/findings-from-apple-womens-health-study-advance-science-around-menstrual-cycles/
Latest News. UPDATE. Apple Music Live returns for a brand-new season with Ed Sheeran. May...8 months ago, https://www.apple.com/newsroom/2022/08/apple-expands-self-service-repair-to-mac-notebooks/
AirPods · App Store · Apple Arcade · Apple TV+ · Company News · Education · Environment · Events · Health · iPad · iPhone · Mac · Music...5 months ago, https://www.apple.com/newsroom/2022/11/the-new-apple-pacific-centre-opens-in-vancouver/
Apple Saket will open this Thursday April 20 in New Delhi. April 19 2023 · Apple Newsroom. The latest news and updates direct from...9 months ago, https://www.apple.com/newsroom/2022/07/hundreds-queue-for-the-opening-of-apple-brompton-road/
Updates to Pages Numbers Keynote and Swift Playgrounds · Press Contacts · Latest News · Apple Footer.6 months ago, https://www.apple.com/newsroom/2022/10/apple-learning-coach-now-open-to-more-teachers-across-the-us/
Developers can access a robust library of timely relevant and practical content from Apple experts and engineers including news about...6 months ago, https://www.apple.com/newsroom/2022/10/apple-introduces-ask-apple-for-developers/
Apple turns (RED) to raise visibility for World AIDS Day · Choose (RED) This Holiday Season · Raising Visibility · Press Contacts · Latest News.5 months ago, https://www.apple.com/newsroom/2022/12/apple-turns-red-to-raise-visibility-for-world-aids-day/
Users could previously record their screen via a dedicated button on the Control Center. Advertisement. Sports tab in Apple News. Sports news on...1 month ago, https://indianexpress.com/article/technology/tech-news-technology/ios-16-5-first-beta-siri-screen-recording-8540718/
Apple's chief executive Tim Cook at awards show in 2022. Image source Getty Images. By Monica Miller. BBC News.3 months ago, https://www.bbc.com/news/business-64258289
