Enabling My Sports syncing between the Apple News and Apple TV apps means that the teams you follow are automatically synced between both. Tap...2 months ago, https://www.imore.com/iphone/how-to-use-my-sports-in-apple-news-to-track-your-team
Data is a real-time snapshot *Data is delayed at least 15 minutes. Global Business and Financial News Stock Quotes and Market Data and...1 month ago, https://www.cnbc.com/2023/03/09/apple-music-classical-app-release-date-march-28.html
Spotify is looking to give Apple a good bruising in the press. The music streamer is taking its grievances with the Silicon Valley goliath...6 months ago, https://www.cnn.com/2022/11/01/media/spotify-apple-app-store-reliable-sources/index.html
Donations are limited to a maximum of $1000000 and go to the National Park Foundation. Press Contacts. Apple Media Helpline. media.help@apple.8 months ago, https://www.apple.com/newsroom/2022/08/apple-celebrates-americas-parks/
Sign up for free and start receiving your daily dose of cybersecurity news insights and tips. Email. Solution SpotlightNEW.2 months ago, https://thehackernews.com/2023/02/apple-warns-of-3-new-vulnerabilities.html
Elon Musk has said Apple has halted most of its advertising on Twitter and accused the company of threatening to remove the platform from...5 months ago, https://www.bbc.com/news/technology-63788437
AirPods · App Store · Apple Arcade · Apple TV+ · Company News · Education · Environment · Events · Health · iPad · iPhone · Mac · Music...4 months ago, https://www.apple.com/newsroom/2022/12/across-the-globe-apple-and-its-teams-find-new-ways-to-give/
... from a factory in Arizona Apple CEO Tim Cook said last month at an internal company meeting in Germany according to Bloomberg News.5 months ago, https://www.cnbc.com/2022/11/15/apple-to-buy-chips-from-arizona-factory-ceo-tim-cook-reportedly-says.html
AirPods · App Store · Apple Arcade · Apple TV+ · Company News · Education · Environment · Events · Health · iPad · iPhone · Mac · Music...11 months ago, https://www.apple.com/newsroom/2022/05/the-music-lives-on/
Like Meta's latest headset Apple's device will use both virtual and augmented reality. With VR users see images and content within the goggles...3 months ago, https://www.bloomberg.com/news/articles/2023-01-23/apple-reality-pro-details-eye-hand-tracking-app-store-3d-ios-like-interface
Special Sessions · The Store and Team · Sustainability · Apple in the UK · Press Contacts · Latest News · Apple Footer.9 months ago, https://www.apple.com/newsroom/2022/07/apple-brompton-road-opens-july-28-in-london/
Apple's iOS 12.5.7 update is available for affected devices. Julia Musto. By Julia Musto | Fox News.3 months ago, https://www.foxnews.com/tech/apple-users-old-iphone-ipad-install-security-update
AirPods · App Store · Apple Arcade · Apple TV+ · Company News · Education · Environment · Events · Health · iPad · iPhone · Mac · Music...9 months ago, https://www.apple.com/newsroom/2022/07/apple-introduces-apple-music-sessions/
Welcome to our Apple Breakfast column which includes all of the Apple news you missed last week in a handy bite-sized roundup.2 months ago, https://www.macworld.com/article/1525007/iphone-se-devotees-size-touch-id-price.html
Latest News. UPDATE. Apple Music Live returns for a brand-new season with Ed Sheeran. May...7 months ago, https://www.apple.com/newsroom/2022/10/meet-seven-hispanic-and-latin-app-creators-breaking-barriers-with-technology/
When the user wakes up in the morning they simply press stop to end the program.6 months ago, https://www.apple.com/newsroom/2022/11/veterans-find-relief-from-nightmares-with-nightware-and-apple-watch/
28 that Apple is lending the company $252 million to help cover upfront costs for ... Globalstar's shares jumped more than 10% on the news.2 months ago, https://spacenews.com/apple-loans-globalstar-252-million-for-satellite-enabled-iphones/
Apple has been accused by some tech experts of not making their Air Tag products safe. ABC News. LaPrecia Sanders Smith's mother told "...3 months ago, https://abcnews.go.com/US/apple-airtags-causing-major-security-concerns-reports-stalking/story?id=96531871
At one point it alone made about 85% of the Pro lineup of iPhones according to market-research firm Counterpoint Research. What's News. See...5 months ago, https://www.wsj.com/articles/apple-china-factory-protests-foxconn-manufacturing-production-supply-chain-11670023099
A headline risk is the risk that a company's share price will decline from negative news coverage. Apple shares fell to their lowest level...4 months ago, https://www.cnbc.com/2022/12/29/analyst-remains-bullish-on-apple-as-its-a-lot-more-of-headline-risks.html
related investing news · Read more about tech and crypto from CNBC Pro · Apple to combine 5G and processor in chip.6 months ago, https://www.cnbc.com/2022/10/18/apple-to-launch-a-foldable-ipad-rather-than-iphone-in-2024-analyst.html
An illustration of iPhone 12 Pro and journalists. The News Partner Program expands Apple's work with and support for journalism. Cupertino...20 months ago, https://www.apple.com/newsroom/2021/08/apple-introduces-the-news-partner-program/
I can now share some good news. Apple Inc.'s next iMac desktop is at an advanced stage of development called engineering validation testing...2 months ago, https://www.bloomberg.com/news/newsletters/2023-03-05/when-is-apple-aapl-releasing-new-mac-pro-15-inch-macbook-air-new-imac-m3-levgn4yc
This week Apple invited various members of the press and influencers to give a closer look at games coming to iPhone iPad Apple TV...2 months ago, https://9to5mac.com/2023/02/17/apple-event-gaming-iphone-mac/
Apple (APPL) and Nvidia (NVDA) made headlines Monday with bullish implications for both Club holdings. Here's a recap of the news and our take...2 months ago, https://www.cnbc.com/2023/02/27/apple-nvidia-in-the-news-our-take-on-these-outsized-tech-holdings-.html
Portrait mode and Spatial Audio require a Mac with Apple silicon. Press Contacts. Apple Media Helpline. media.help@apple.com...10 months ago, https://www.apple.com/newsroom/2022/07/all-new-macbook-air-with-m2-available-to-order-starting-friday-july-8/
Welcome to our weekend Apple Breakfast column which includes all of the Apple news you missed this week in a handy bite-sized roundup.2 months ago, https://www.macworld.com/article/1519210/why-apple-is-probably-skipping-the-spring-event-this-year.html
Wedbush Securities analyst Daniel Ives reiterated his outperform or buy rating on Apple stock. He also upped his 12-month price target to 190...1 month ago, https://www.investors.com/news/technology/apple-stock-boosted-by-stable-iphone-demand/
Additional iPhone Payments terms are at apple.com/legal/sales-support/iphoneinstallments_us. Press Contacts. Apple Media Helpline. media.help@...7 months ago, https://www.apple.com/newsroom/2022/10/iphone-14-plus-available-in-stores-friday/
Apple is reportedly developing a continuous glucose monitoring (CGM) device that doesn't require pricking the skin. · This news caused Abbott and...2 months ago, https://www.fool.com/investing/2023/02/28/abbott-dexcom-investors-worried-apple-news/
Apple plans to replace Broadcom's Wi-Fi and Bluetooth chip according to the Bloomberg News report which added that Apple is the U.S....3 months ago, https://www.reuters.com/technology/apple-drop-key-broadcom-chip-2025-in-house-design-bloomberg-news-2023-01-09/
From Google News and Microsoft Start to Apple News (iOS Only) ... here are the best news apps for Google's Android and Apple's iOS 2023.1 month ago, https://ceoworld.biz/2023/03/15/used-by-top-ceos-best-apps-for-reading-news-for-googles-android-and-apples-ios-2023/
Portrait mode and Spatial Audio require a Mac with Apple silicon. Press Contacts. Apple Media Helpline. media.help@apple.com...11 months ago, https://www.apple.com/newsroom/2022/06/apple-unveils-all-new-macbook-air-supercharged-by-the-new-m2-chip/
Apple's Tim Cook. Photographer: Nic Coury/Bloomberg. Apple Inc. after seven years of development is nearly ready to launch its first mixed...3 months ago, https://www.bloomberg.com/news/newsletters/2023-01-08/when-will-apple-launch-the-reality-pro-mixed-reality-headset-apple-2023-devices-lcnfzkc7
Visit developer.apple.com/weatherkit for feature availability. Live Activities will be available to developers later this year. Press Contacts.11 months ago, https://www.apple.com/newsroom/2022/06/apple-provides-developers-with-even-more-powerful-technologies/
AirPods · App Store · Apple Arcade · Apple TV+ · Company News · Education · Environment · Events · Health · iPad · iPhone · Mac · Music...6 months ago, https://www.apple.com/newsroom/2022/11/apple-celebrates-the-holiday-season/
... for fans to easily follow the league or their favorite clubs in Apple News with the ability to watch highlights right in the News app.10 months ago, https://www.apple.com/newsroom/2022/06/apple-and-mls-to-present-all-mls-matches-for-10-years-beginning-in-2023/
Apple to start using in-house screens from 2024 - Bloomberg News. Reuters. The Apple Inc logo is seen at the entrance to the Apple store in...3 months ago, https://www.reuters.com/technology/apple-begin-making-in-house-screens-2024-bloomberg-news-2023-01-11/
UBS forecasts that Apple 's (ticker: AAPL) iPhone shipments will come to ... In other Apple news company shareholders are being advised by...2 months ago, https://www.barrons.com/articles/apple-stock-iphone-android-tim-cook-pay-a838cd3e
Apple's Chip Strategy Is Great News for Shareholders Bad News for Skyworks Broadcom and Qualcomm. By Billy Duberstein – Jan 25 2023 at 6:...3 months ago, https://www.fool.com/investing/2023/01/25/apples-chip-strategy-great-news-for-shareholders/
Apple's more than 100000 employees are dedicated to making the best products on earth and to leaving the world better than we found it. Press...12 months ago, https://www.apple.com/newsroom/2022/04/apples-self-service-repair-now-available/
The Bench. US-IT-APPLE-NEWS-FEED. Tim Cook and Jony Ive in 2019. Photographer:...3 months ago, https://www.bloomberg.com/news/newsletters/2023-02-05/is-an-iphone-ultra-or-iphone-fold-coming-from-apple-ceo-remarks-offer-clues-ldrhx53a
Apple Ford and Estee Lauder are in the news Thursday. Here are our takes. Published Thu Mar 23 20234:15 PM EDT Updated Thu Mar 23 20234:50 PM EDT.1 month ago, https://www.cnbc.com/2023/03/23/club-holdings-apple-ford-and-estee-lauder-news-thursday-our-takes.html
Apple Watch Mirroring is available on Apple Watch Series 6 or later. Press Contacts. Apple Media Helpline. media.help@apple.com...11 months ago, https://www.apple.com/newsroom/2022/06/watchos-9-delivers-new-ways-to-stay-connected-active-and-healthy/
Apple could finally announce its long-awaited mixed reality headset later in 2023. · The business is still growing at a steady pace so the...3 months ago, https://www.fool.com/investing/2023/01/26/does-this-vr-news-make-apple-stock-a-buy-for-2023/
Then they steal the users' phones log in and change their Apple ID passwords by entering the passcode locking them out of iCloud.2 months ago, https://www.cbsnews.com/news/how-to-prevent-iphone-hacks-apple-security/
The Associated Press contributed to this report. Julia Musto is a reporter for Fox News and Fox Business Digital.4 months ago, https://www.foxnews.com/tech/apple-iphone-new-data-security-protections-how-to-update-your-device
Apple occasionally launches new products via press release with the most recent being the 10th-gen iPad M2 iPad Pro and Apple TV 4K in...3 months ago, https://www.macworld.com/article/1474251/rumor-january-announement-macbook-pro-mac-mini.html
Apple today introduced its second Impact Accelerator class — a cohort of 16 Black- Hispanic/Latinx- and Indigenous-owned businesses...8 months ago, https://www.apple.com/newsroom/2022/08/apple-propels-environmental-business-solutions-forward-with-second-impact-accelerator-class/
April 3 (Reuters) - Apple Inc (AAPL.O) is eliminating a small number of roles within its corporate retail teams Bloomberg News reported on...1 month ago, https://www.reuters.com/technology/apple-cut-small-number-jobs-some-corporate-retail-teams-bloomberg-news-2023-04-03/
Khanna who will be among those attending the meetings told CBS News Wednesday that the topics of discussion will include how U.S companies can...1 month ago, https://www.cbsnews.com/news/u-s-lawmakers-to-meet-apple-disney-ceos-discuss-china-bob-iger-tim-cook/
Club holdings Apple (AAPL) Nvidia (NVDA) and Walt Disney (DIS) all made headlines Monday. Here's how the news impacts our investment case for...2 months ago, https://www.cnbc.com/2023/02/13/apple-nvidia-and-disney-are-in-the-news-heres-a-recap-and-our-take.html
Jeff Robbin long-time Apple engineer will take on Abbott's responsibilities Bloomberg News reported. Earlier this year Insider reported...2 months ago, https://www.reuters.com/technology/apple-cloud-chief-abbott-step-down-bloomberg-news-2023-03-03/
The Apple Certified Support Professional badge is a required prerequisite to earn the Apple Certified IT Professional badge. Press Contacts.11 months ago, https://www.apple.com/newsroom/2022/05/apple-introduces-new-professional-training-to-support-growing-it-workforce/
News publishers can now direct iPhone app users to a website to subscribe — instead of being locked into Apple's system and Apple's rules.9 months ago, https://www.niemanlab.org/2022/07/still-giving-apple-30-of-your-news-subscription-revenue-you-no-longer-have-to-and-heres-how-to-stop/
Police denied KOMO News' request for the surveillance footage for now because of the ongoing investigation. “From the masks that the folks...1 month ago, https://komonews.com/news/local/500k-electronics-stolen-alderwood-mall-apple-store-lynnwood-theft-retail-police-department-crime-burglary-operation-seattle-coffee-gear-break-in-merchandise-hole-cut-business
Data is a real-time snapshot *Data is delayed at least 15 minutes. Global Business and Financial News Stock Quotes and Market Data and...4 months ago, https://www.cnbc.com/2023/01/03/apples-market-cap-falls-under-2-trillion-as-selloff-continues.html
Sharing control of your home and receiving Home notifications require a home hub. Only Apple TV and HomePod are supported as home hubs. Press...7 months ago, https://www.apple.com/newsroom/2022/09/watchOS-9-is-available-today/
In Apple News fans can easily follow their favorite teams and watch personalized MLB highlights right in the News app.9 months ago, https://www.apple.com/newsroom/2022/07/apple-and-mlb-announce-august-friday-night-baseball-doubleheader-schedule/
Police say at least 21 people in New York City have had their fancy Apple headphones stolen right off their heads by a roving team of...2 months ago, https://abcnews.go.com/US/wireStory/nyc-thieves-stealing-apple-headphones-off-victims-heads-97476144
Deep dive of iOS code reveals new sports features in the works for iPhone. 4 Apr 2023 Steve McCaskill. News. Getty Images. SHARE THIS ARTICLE. Apple has the...1 month ago, https://www.sportspromedia.com/broadcast-ott/apple-sports-streaming-multiview-ios-mls-mlb/
Police say at least 21 people in New York City have had their fancy Apple headphones stolen right off their heads by a roving team of...2 months ago, https://abcnews.go.com/US/wireStory/nyc-thieves-stealing-apple-headphones-off-victims-heads-97476144
Deep dive of iOS code reveals new sports features in the works for iPhone. 4 Apr 2023 Steve McCaskill. News. Getty Images. SHARE THIS ARTICLE. Apple has the...1 month ago, https://www.sportspromedia.com/broadcast-ott/apple-sports-streaming-multiview-ios-mls-mlb/
Got a confidential news tip? We want to hear from you. Get In Touch. Advertise With Us. Please Contact Us. CNBC Newsletters.7 months ago, https://www.cnbc.com/2022/09/13/apple-plans-new-spots-for-ads-in-app-store-by-the-end-of-the-year.html
Data is a real-time snapshot *Data is delayed at least 15 minutes. Global Business and Financial News Stock Quotes and Market Data and...8 months ago, https://www.cnbc.com/2022/08/15/apple-tells-employees-to-come-in-3-times-a-week-starting-september.html
Fortnite-maker Epic Games and Apple (ticker: AAPL) showed off capabilities that underscore how far ahead they are in the technologies needed...1 month ago, https://www.barrons.com/articles/metaverse-apple-epic-meta-stock-price-e80bafe0
A press attendee holds up the completely redesigned ultra-thin MacBook Air at the hands-on area in Steve Jobs Theater at Apple Park.11 months ago, https://www.apple.com/newsroom/2022/06/wwdc22-highlights/
deine technik. auf den punkt. Über uns / Team · Kontakt · Unsere Technik-Experten · Werbung / Mediadaten · Jobs · Messen und Events · News-Apps.1 hour ago, https://www.inside-digital.de/news/ios-apple-veroeffentlicht-neuartiges-iphone-update-das-steckt-dahinter
A busy week of earnings season and lots of news developments have us revising some of the price targets and ratings on the stocks in the...5 hours ago, https://www.cnbc.com/2023/05/07/were-making-five-price-target-changes-and-one-rating-upgrade-after-a-crazy-week-of-earnings.html
Download the ABC News app — Apple App Store | Google Play. "Organisations who educate young drivers and support their pathway to gaining a...21 hours ago, https://www.abc.net.au/news/2023-05-07/tas-kids-stuck-after-keys2drive-learner-program-axed/102312544
... Max's Love & Death Netflix's The Lincoln Lawyer) Bill Lawrence (Apple's Ted Lasso Shrinking) Alex Kurtzman (the Star Trek franchise...22 hours ago, https://www.hollywoodreporter.com/tv/tv-news/writers-strike-showrunners-unite-studio-demands-1235481502/
Apple News+. Access to hundreds of magazines and leading newspapers local news sports coverage and audio stories featuring the week's best articles. Learn...31 months ago, https://www.apple.com/apple-one/
iPhone X showing Apple News' Midterm Elections section. The 2018 Midterm Elections feature is for casual readers and political enthusiasts alike...58 months ago, https://www.apple.com/newsroom/2018/06/apple-news-launches-2018-midterm-elections-section/
Apple News has launched a new COVID-19 section where users can be sure that they can find the latest verified reporting from trusted news...37 months ago, https://www.apple.com/newsroom/2020/03/apples-covid-19-response/
Apple News provides one convenient place to find details about the 20 Democratic presidential candidates.46 months ago, https://www.apple.com/newsroom/2019/06/apple-news-launches-candidate-guide-ahead-of-2020-democratic-debates/
Apple's more than 100000 employees are dedicated to making the best products on earth and to leaving the world better than we found it. Press...20 months ago, https://www.apple.com/newsroom/2021/08/apple-acquires-classical-music-streaming-service-primephonic/
Do you love your Roku Fire TV Apple TV Google TV and more? ... Originally Local Now only streamed your local weather and news...6 hours ago, https://cordcuttersnews.com/the-top-10-free-cord-cutting-apps-of-2023-for-roku-apple-tv-google-tv-roku-tv-fire-tv-more/
We will never stop our tireless work to keep our users safe. Press Contacts. Apple Media Helpline. media.help@apple.com...44 months ago, https://www.apple.com/newsroom/2019/09/a-message-about-ios-security/
Apple's new initiative supports nonprofit organizations that are focused on news literacy programs. Cupertino California — Apple today...49 months ago, https://www.apple.com/newsroom/2019/03/apple-teams-with-media-literacy-programs-in-the-us-and-europe/
In other Apple news SVP Deirdre O'brien sold 43622 shares of the business's stock in a transaction on Monday April 3rd.12 hours ago, https://www.defenseworld.net/2023/05/07/apple-nasdaqaapl-pt-raised-to-185-00-at-morgan-stanley.html
In other Apple news SVP Deirdre O'brien sold 43622 shares of the stock in a transaction that occurred on Monday April 3rd.12 hours ago, https://www.defenseworld.net/2023/05/07/apple-nasdaqaapl-pt-raised-to-193-00.html
